{
    "problem_name": "Big_Example",
    "yard_type": "stub",
    "parameters": {
        "alpha_a": 6750,
        "alpha_d": 6750,
        "beta_a": 292.5,
        "beta_d": 225,
        "track_speed_kph": 16,
        "ladder_speed_kph": 10,
        "wagon_length_m": 15
        },
    "track_lengths_m": [2000, 1800, 1700, 800, 700, 600, 500, 400, 300, 200, 200, 100],
    "left_lead_m": 2000,
    "right_lead_m":   0,
    "track_occupancies": {
        "1": [6, 12, 13, 9, 10, 12, 6, 1, 1, 2, 13, 8, 13, 7, 10, 3, 5, 6, 3, 5, 12, 13, 11, 13, 3, 5, 8, 8, 10, 2],
        "2": [8, 1, 7, 10, 10, 8, 7, 10, 2, 1, 13, 2, 9, 9, 4, 11, 10, 9, 8, 4, 7, 6, 2],
        "3": [10, 4, 5, 9, 2, 12, 13, 11, 5, 1, 4, 10, 3, 1, 5, 10, 3, 8, 8, 11, 10, 9, 7, 10],
        "4": [4, 8, 8, 5, 12, 6, 10, 4, 7, 9, 1, 3, 11, 8, 8, 10, 8, 4, 13, 11, 1, 9, 8]
        },
    "desired_block_order": [1, 2, 3, 4, 13, 8, 7, 9, 5, 6, 12],
    "other_blocks_to_form": [10, 11]
  }
